{
  "schema": "overnight.digest/v1",
  "id": "2026-10-07",
  "generatedAt": "2026-10-07T06:00:00.000Z",
  "window": {
    "since": "2026-10-06T06:00:00.000Z",
    "until": "2026-10-07T06:00:00.000Z"
  },
  "owner": "acme-dev",
  "headline": "12 pull requests merged and 23 commits pushed across 9 projects, with 19 contributions from agents. tidepool-web needs attention and 4 more are worth a look.",
  "summarizer": {
    "kind": "llm",
    "model": "claude-sonnet-5-5"
  },
  "totals": {
    "projectsActive": 9,
    "mergedPRs": 12,
    "commits": 23,
    "releases": 0,
    "ciFailures": 3,
    "openPRsNeedingAttention": 2,
    "issuesOpened": 2,
    "issuesClosed": 1,
    "deployments": 7,
    "deploymentsFailed": 1,
    "starsDelta": 26,
    "agentContributions": 19
  },
  "projects": [
    {
      "id": "acme-dev/tidepool-web",
      "name": "tidepool-web",
      "url": "https://github.com/acme-dev/tidepool-web",
      "description": "Customer dashboard for Tidepool",
      "defaultBranch": "main",
      "vercelProject": "tidepool-web",
      "siteUrl": "https://tidepool-web.example.app",
      "mergedPRs": [
        {
          "number": 29468,
          "title": "fix: resolve chart tooltips edge case",
          "url": "https://github.com/acme-dev/tidepool-web/pull/29468",
          "author": {
            "login": "acme-dev",
            "isBot": false
          },
          "at": "2026-10-06T12:45:00.000Z",
          "additions": 212,
          "deletions": 9,
          "labels": ["bug"]
        }
      ],
      "openPRs": [],
      "commits": [
        {
          "sha": "1795139fdc0420364f0c30bd035d6deb6f5004e3",
          "message": "resolve onboarding flow",
          "url": "https://github.com/acme-dev/tidepool-web/commit/1795139fdc0420364f0c30bd035d6deb6f5004e3",
          "author": {
            "login": "acme-dev",
            "isBot": false
          },
          "at": "2026-10-06T18:06:00.000Z",
          "branch": "main"
        },
        {
          "sha": "d6c3b249ac8dff14e59b29749a36e2c83e296d9b",
          "message": "refactor chart tooltips",
          "url": "https://github.com/acme-dev/tidepool-web/commit/d6c3b249ac8dff14e59b29749a36e2c83e296d9b",
          "author": {
            "login": "acme-dev",
            "isBot": false
          },
          "at": "2026-10-07T04:35:00.000Z",
          "branch": "main"
        },
        {
          "sha": "c3e2bc61bdedf6e3f2b654ecf6ddd805ec6fee6b",
          "message": "correct chart tooltips",
          "url": "https://github.com/acme-dev/tidepool-web/commit/c3e2bc61bdedf6e3f2b654ecf6ddd805ec6fee6b",
          "author": {
            "login": "acme-dev",
            "isBot": false
          },
          "at": "2026-10-07T05:34:00.000Z",
          "branch": "main"
        }
      ],
      "releases": [],
      "ciFailures": [
        {
          "workflow": "lint",
          "runId": 9847954850,
          "url": "https://github.com/acme-dev/tidepool-web/actions/runs/9847954850",
          "branch": "main",
          "at": "2026-10-07T01:32:00.000Z",
          "conclusion": "failure",
          "commitMessage": "resolve onboarding flow"
        }
      ],
      "issues": [
        {
          "number": 19872,
          "title": "chart tooltips crashes on empty input",
          "url": "https://github.com/acme-dev/tidepool-web/issues/19872",
          "author": {
            "login": "acme-dev",
            "isBot": false
          },
          "at": "2026-10-06T10:58:00.000Z",
          "state": "opened",
          "labels": ["triage"]
        }
      ],
      "deployments": [
        {
          "id": "dpl_2857c5aff",
          "project": "tidepool-web",
          "url": "https://tidepool-web.example.app",
          "target": "production",
          "state": "ERROR",
          "at": "2026-10-07T05:59:00.000Z",
          "commitMessage": "fix: resolve chart tooltips edge case",
          "branch": "main"
        }
      ],
      "stats": {
        "stars": 9854,
        "forks": 492,
        "starsDelta": 1,
        "forksDelta": 0,
        "openIssues": 16
      },
      "health": "red",
      "summary": "1 pull request merged, led by \"fix: resolve chart tooltips edge case\". The production deploy failed and needs a look.",
      "highlights": [
        "Merged #29468: fix: resolve chart tooltips edge case",
        "Production deploy failed",
        "CI failing on main: lint",
        "3 commits on main"
      ]
    },
    {
      "id": "acme-dev/orbit-docs",
      "name": "orbit-docs",
      "url": "https://github.com/acme-dev/orbit-docs",
      "description": "Documentation site for Orbit",
      "defaultBranch": "main",
      "vercelProject": "orbit-docs",
      "siteUrl": "https://orbit-docs.example.app",
      "mergedPRs": [
        {
          "number": 29629,
          "title": "feat: implement search index",
          "url": "https://github.com/acme-dev/orbit-docs/pull/29629",
          "author": {
            "login": "claude[bot]",
            "isBot": true
          },
          "at": "2026-10-06T20:23:00.000Z",
          "additions": 386,
          "deletions": 109,
          "labels": ["enhancement"]
        },
        {
          "number": 29630,
          "title": "feat: add search index",
          "url": "https://github.com/acme-dev/orbit-docs/pull/29630",
          "author": {
            "login": "acme-dev",
            "isBot": false
          },
          "at": "2026-10-06T22:14:00.000Z",
          "additions": 284,
          "deletions": 60,
          "labels": ["enhancement"]
        },
        {
          "number": 29628,
          "title": "fix: fix sidebar edge case",
          "url": "https://github.com/acme-dev/orbit-docs/pull/29628",
          "author": {
            "login": "acme-dev",
            "isBot": false
          },
          "at": "2026-10-07T04:04:00.000Z",
          "additions": 133,
          "deletions": 118,
          "labels": ["bug"]
        }
      ],
      "openPRs": [],
      "commits": [
        {
          "sha": "16119877c043bc438262972297da302868083a9f",
          "message": "refactor quickstart",
          "url": "https://github.com/acme-dev/orbit-docs/commit/16119877c043bc438262972297da302868083a9f",
          "author": {
            "login": "renovate[bot]",
            "isBot": true
          },
          "at": "2026-10-06T08:36:00.000Z",
          "branch": "main"
        },
        {
          "sha": "2936633911d2fc63e6755f2c823c5582cc8e178e",
          "message": "correct API reference",
          "url": "https://github.com/acme-dev/orbit-docs/commit/2936633911d2fc63e6755f2c823c5582cc8e178e",
          "author": {
            "login": "renovate[bot]",
            "isBot": true
          },
          "at": "2026-10-06T13:32:00.000Z",
          "branch": "main"
        },
        {
          "sha": "2db654fd01be4522d2c26b930014ad03e7e8d773",
          "message": "handle API reference",
          "url": "https://github.com/acme-dev/orbit-docs/commit/2db654fd01be4522d2c26b930014ad03e7e8d773",
          "author": {
            "login": "acme-dev",
            "isBot": false
          },
          "at": "2026-10-06T22:51:00.000Z",
          "branch": "main"
        },
        {
          "sha": "b1ce10ade950ec351a7c4ef1ddef38c524bc7747",
          "message": "fix sidebar",
          "url": "https://github.com/acme-dev/orbit-docs/commit/b1ce10ade950ec351a7c4ef1ddef38c524bc7747",
          "author": {
            "login": "acme-dev",
            "isBot": false
          },
          "at": "2026-10-07T05:39:00.000Z",
          "branch": "main"
        }
      ],
      "releases": [],
      "ciFailures": [
        {
          "workflow": "build",
          "runId": 9039649907,
          "url": "https://github.com/acme-dev/orbit-docs/actions/runs/9039649907",
          "branch": "feature/search-index",
          "at": "2026-10-06T07:59:00.000Z",
          "conclusion": "failure"
        }
      ],
      "issues": [],
      "deployments": [
        {
          "id": "dpl_69fb9ef22",
          "project": "orbit-docs",
          "url": "https://orbit-docs.example.app",
          "target": "production",
          "state": "READY",
          "at": "2026-10-06T15:10:00.000Z",
          "commitMessage": "fix: fix sidebar edge case",
          "branch": "main"
        },
        {
          "id": "dpl_5a2fc12e5",
          "project": "orbit-docs",
          "url": "https://orbit-docs.example.app",
          "target": "preview",
          "state": "READY",
          "at": "2026-10-06T13:23:00.000Z",
          "commitMessage": "fix: fix sidebar edge case",
          "branch": "feature/quickstart"
        },
        {
          "id": "dpl_04e40b4ef",
          "project": "orbit-docs",
          "url": "https://orbit-docs.example.app",
          "target": "preview",
          "state": "READY",
          "at": "2026-10-06T20:25:00.000Z",
          "commitMessage": "fix: fix sidebar edge case",
          "branch": "feature/quickstart"
        }
      ],
      "stats": {
        "stars": 10003,
        "forks": 496,
        "starsDelta": 2,
        "forksDelta": 0,
        "openIssues": 12
      },
      "health": "yellow",
      "summary": "3 pull requests merged, 1 by agents, led by \"feat: implement search index\". A CI run failed on a feature branch.",
      "highlights": [
        "Merged #29629: feat: implement search index",
        "Merged #29630: feat: add search index",
        "4 commits on main"
      ]
    },
    {
      "id": "acme-dev/ember-ui",
      "name": "ember-ui",
      "url": "https://github.com/acme-dev/ember-ui",
      "description": "Shared React component library",
      "defaultBranch": "main",
      "vercelProject": "ember-ui",
      "siteUrl": "https://ember-ui.example.app",
      "mergedPRs": [
        {
          "number": 29669,
          "title": "chore: bump dependencies",
          "url": "https://github.com/acme-dev/ember-ui/pull/29669",
          "author": {